,0
652,"My buddy and I do gravel riding before work, you can just add it to your calendar as a &quot;rolling work sync&quot;. Also, &quot;check email&quot;, don&#39;t you mean check Slack for an hour? ....also, I just joined a CrossFit gym haha"
653,"Hi, great and very informative video! It is about my boyfriend wnating to be a data scientist. Can i ask you some advice? He has a bachelor degree in business and a master degree in financial counseling. And he finished the 6 month data analyst course at flatiron boot camp before 2 months. the boot camp introduced him a company and the company suggested him a bussiness analyst position of 56000 dollars salary. He wants this position very much.  Im worried that this salary would be too low, considering his background 😭"
654,Now do day in the life of a submariner
655,You&#39;re watching TED 😂😂😂😂😂😂 That&#39;s how I decompress. His voice is so calming.
656,I am a single mother and I should say- you are living the dream daily life!
657,Do mostly data analysts work from home? I mostly want to work with a sports team as a data analyst.
658,I have almost no idea what you actually do.
659,Congratulations on the 700 subs. Amazing video as usual.<br>Also please do a video on Jupyter notebook shortcuts or visualisation tutorials using not so complicated libraries like matplotlib
660,"Thanks Luke, this is informative. I am Data Scientist from India using 2020 13inch mac pro m1. Can you do a video on how to use dual monitor setup in mac?"
661,I don’t have a Mac computer
662,Can you do this same video but for Windows users?
663,what&#39;s theme are you using in iterm?
664,"Hey Luke, I have been watching your videos and till now, I was under the impression that you are a relatively famous Youtuber :D Best of luck and full support! I love this video."
665,Awesome videos! Love your channel. Keep it up. Love to see more tips and tricks for mac(first time user). Planning to buy a MBP 13M1
666,Love keyboard shortcuts! That’s 8 days of mountain bike riding you could have back!
667,See I told ya to cover general topics that many will find relatable to and here you are!! This video is about to blow up
668,Love all videos keep up the work <br>Early gang:
669,"Thanks! Great, simple method!"
670,Hi Luke! Which parallels desktop edition to purchase for beginner data analysts?
671,Thanks! Do you think the Mac gets slower because of Windows (Paralelles)?
672,"Hello, Luke! Been a while since you posted this video. Im wondering if you have had any issues working with Power BI during this time. Considering buying the M1 Max 32GB 16 version my self, so would been nice with and update on this. Thanks!"
673,"also have a mac with an M1 wanted to load it but it was there ,,To access this page,you need to be a member of the windows Insider program&#39;&#39; help"
674,"Hey Luke, Great Video thank you, will download Parallels tonight, Can I also use SQL Server Management Studio inside Windows on Parallels?"
675,Nice video! Do you keep your data inside the VM? What if you have a small SSD (256gb) and you need to work with an external SSD?
676,"Hey thanks for the video,  I am considering buying the new Macbook Pro with M1 Pro/Max but I must run Windows on it (because I must use Microsoft Office that runs on Windows, the Office for MacOS doesn&#39;t meet my work requirements which sucks). <br><br>Do you have any troubles using Microsoft Office for Windows that runs through Parallel, on your M1 Mac?<br><br>Thanks, honestly Microsoft Office is the only thing keeping me from pre-ordering the new Mac Pro with M1 Max chip now."
677,Thank you for this! How can we use SQL on MacOS?
678,"Super helpful video, now I can use PowerBI on my Mac"
679,Hi could you please confirm that Parrelel can run the SAP?<br><br>Awaiting response and thanks in advance.
680,"Hi there!  my old laptop is dead and I need an urgent one.  I thought about buying a Mac book air m1 with 16 gb RAM and 256 gb SSD for university use (taking advantage of the discount) and I am thinking about the possibility of doing a master in &quot;big data and business analytics&quot;.  It is not sure but I wanted to know if it would be ok for that and excel (data base), sql, power BI, access, sap. Or if I should buy a windows pc.  I saw that in a previous video of yours you had compared it to a Dell, but it is more expensive.  Thanks in advance.  🙏"
681,"Thanks a lol! I was thinking change my air with i3 for a M1 to emulate and use PBI. Thank, thanks"
682,Is parallels still available?
683,"Does autoCAD or revit work through parallels? I&#39;m starting school as a civil engineering student, and I would like to know if the m1 mac can run typical engineering programs that usually only work on windows?"
684,Hello sir i want to do power bi course.  Can you suggest me to have macbook m1 or any other laptop.
685,"Hi, Mr. Luke, first of all, congratulations of your channel. I&#39;d like to know. Does your mac is 8gb or 16gb ram? whats your opinion about use a Mac with parallels or a windows with 16ram to use power bi related about the performance to de PBI? Thank you!"
686,"hello sir i&#39;m from india,i am a student of data science so i want to buy a mac m1(8gb ram &amp; 256gb ssd) if i install UTM virtual machine after then i install windows 10 then can i use python,R,Tableu,Power Bi,Ms word ,Ms excel etc windows applications how will it be works ? <br>is UTM virtual machine will be installed on mac m1?"
687,Is Parallels good for your SSD? I had it open for 6 hours amd it has written 300GB of memory to SSD. I have an 8GB RAM and used a 4GB CPU/GPU on Parallels.
688,"Hi mate! How are you? I just bought my Dell xps13 9310 and the fun it’s making too much noise, I mean, a lot. Is that normal on Dell’s PC. Another question, how is your Mac M1 working with power BI and SQL ? Is it the same as windows on a pc? I was thinking about to replace my dell for a Mac to use this programs  with a big amount of data.<br>Thank you👍🏻"
689,Like
690,you mean i just paid $280 for windows that will to work on Apple WTF
691,Are you using a 8gb MacBook air M1?
692,"Love mac hardware, want windows software 😭"
693,Beersmith as an example!! Are you a homebrewer?
694,"People say Parallels work better now but something about allocating resources separately just to run a subpar Windows on a $3000 laptop doesn’t sit right with me. And the software is not even free. <br>I really miss Bootcamp, if I had known the new MB didn’t offer it I would’ve not bought it."
695,Pure gold. Thanks my dude. You got my sub!
696,"Luke, awesome video overview especially for someone who&#39;s trying to understand how to launch Parallells on Macbook. Now that v17 is available, they support Windows 11 now on Macbook, which is awesome!"
697,wait what about windows 365
698,So why not consider a one time purchase of a mini-pc for a couple of hundred bucks and remote into it.  One time expense.
699,"30 cents per hour doesn&#39;t seem like a lot, until you multiply that by (say) 12 hours per day, 20-30 days per month and it quickly becomes absurd. PLUS MS has said that they will NOT be supporting Windows on M1 Macs. Ever. So you&#39;ll be stuck paying $100 per month for Windows, forever. Unless you, you know, just buy a Windows laptop."
700,That’s putting garbage in your designer closet
701,"Does anyone know how to download parallels to an external hd? I am trying to play steam games that are windows based but even though I download to the external, it also downloads all gigs of memory to each game onto parallels which is on my Mac M1 hd. Very frustrating. M1 only has 256gig hd vs 2tb external. Please help!!! :)"
702,"Hi Luke,  Honestly love your content! Great detail and explained in a simple but effective way. luke I have one question is next year 2022 my joining my Master program in  Business analysis. my question is I&#39;m debating between Mac or Windows laptop do you suggest? I&#39;m so confused right now can you help me out ??"
703,Coincidentally; I want to install windows to work on POWER BI! ☻ <br>Thank you.
704,November 2021 and you&#39;re still the only one who managed to explain this whole dilemma to the general public like me. <br>Chapeau 👏👏👏
705,"<a href=""https://www.youtube.com/watch?v=W6N8n99htvw&amp;t=2m40s"">2:40</a> <br>they said that Windows will be able to run natively <br><br><br>Natively means as one <br>basically meaning replace macOS with Windows with no duel boot <br>unless someone can tell me otherwise I stick by my definition of native"
706,Thank you so much! I explored crossover today and it doesn’t work. And I don’t want to pay 130+tax for getting a Parallel Desktop just for light use of some productivity apps on Windows. Amazon desktop seems to be a great option!
707,"In short, Apple sucks and I regret buying the new MacBook with M1. I&#39;ll never buy an Apple product again."
708,So would you recommend this for data science? or you would just recommend for a content creator role?
709,May i request how to install Power BI to  M1 Macbook pro? Please step by step.
710,“And boom there you have it”. Immediately thought of Tipsy Bartender from a couple years back
711,It&#39;s my dream to have this setup at my home.
712,"Hey Luke, nice video! What is the stand you&#39;re using for the MacBook?"
713,"I really love your setup, but i have a question regarding the stand up desk where can I actually find one"
714,"Hello Luke! I would like to know more about extending 2 displays for M1 Mac. In the video, I saw that you used one Starlink hub USB 3.0 to HDMI (I&#39;m clear with it). But for another display, you used another hub and connect to this display through the HDMI (or DP) port of this hub? Please correct me if I was wrong because I heard that this kind of setup will make them duplicated and finally, M1 will export to one external display only."
715,"Hi Luke! Would you care to explain your choice of monitors, specs, and why you prefer two side-by-side instead of an ultra wide? Thanks!"
716,Does your KVM switch allow you to hook up your Mac mouse/keyboard? Do I need anything special to do this?
717,"Hi, thank you for the video.  Would you also share the information for the stand that combines the two monitors?"
718,At this point can we just all admit that the reason we prefer dual monitor setups is so that we have a dedicated screen for Stack Overflow?
719,You ever thought about putting a panel equal to the lowest height you&#39;d lower your desk to cover up the cables?
720,Very helpful. Which monitors do you use?
721,Why don&#39;t you get a pet dog !!! Just saying 😂
722,"Great content, Luke. Keep it up. Was wondering, with multiple monitors in your setup, if you do anything to protect your face/eyes from monitor light? Is it a concern?"
723,Nice set-up!!! How did you attach those Creative Pebble speakers to the monitors?
724,Great video! Just subscribed. I was wondering what KVM switch you’re using as I have a similar setup. Thanks mate. 👍😊
725,Thanks Luke for the StarTech DisplayLink. Game changer!
726,"Everytime I see WFH, my mind thinks it as WTF initially😂"
727,"This channel is a good blend between data analytics, humor and, in this case, setup. Congratulations! Regards from argentina"
728,Setup of the bikes?
729,I would love to see an update of this video and maybe a tutorial on how to setup two separate environments (rosetta and natively) on a m1 mac
730,Thanks Luke. Hello from Brazil
731,Luke I’ve been missing your videos! Can’t wait for you to compare the 16inch base MacBook with the new M1 Mac’s!
732,"Hi Luke, will you test the upcoming new MacBook air and MacBook pro? I still can&#39;t make up my mind to wait for new one or get the M1 instead."
733,Any updates in package support?
734,"Will the python from different soures be different? For example, the python installed by conda and python installed by brew, or by macos terminal directly."
735,Is 8 gb ram enough?
736,Do you know if the MacBook Air 8GB is sufficient to build iOS/iPadOS apps? Should I just get the MacBook Pro to take advantage of the fan to keep the CPU cooled down for long sessions?
737,Can i use flask by installing native python 3.9 natively on m1 ?
738,Good videos!<br>Have you any information of how STATA works on apple M1?<br>Thanks a lot!
739,"wish all developing tools get optimized soon ..  ​ @Luke Barousse  what screen(monitor), keyboard, and mouse combo you use in the video"
740,thanks for sharing! Great to see this kind of testing instead of numerous video editing/benchmark reviews
741,import timeit<br><br>a = 1<br><br>while a &lt; 100000 :<br>    a+= 1<br>    print(a)<br><br>print (timeit.default_timer())<br><br>does this count as the same loop test ?
742,I am a new Mac user and windows python user can you show me or make a video to show how you get python to run without Rosanna thank you
743,Keep at it :)
744,"Hey Luke, can we get your email for contacting regarding freelance data science job from offshore"
745,nice job!
746,"Nice content, looking forward to more .."
747,"super love. this result is consistent with mine, which runs time series for algo-trading by using pandas and statsmodels. Thank you Luke"
748,Good content..!!! Can u also check  Visual Studio performance..
749,"If you&#39;re curious on how the M1 Mac compares to an Intel Mac check out this video:  <a href=""https://www.youtube.com/watch?v=vyPm2fOyS7Y"">https://www.youtube.com/watch?v=vyPm2fOyS7Y</a>"
750,"Is this video of an actual software developer elaborating on whether or not buy an m1 mac based on his experience of daily usage instead of doing benchmarks and video editing ? Holy smokes wish there were more people like you, thx for the review man"
751,thank you very much that was very informative !
752,"People need to understad that the system will use the ram if it is available there. I have 32gb ram on my windows machine and 16 is utilized. All I am using is browser and some office applications, and pdf. I bought 8gb Macbook Air and it uses less than 8 gb because that&#39;s what the system is given. I can run vs code, run some code, have some office programs<br><br>Having said that,16gb will make your computer future proof. I think 16 should already be the norm. The mobile phones have 6 gb ram nowadays. I am planning to keep my computer for next 3 years,, I think I will manage."
753,"Thank you so much Luke, you really helped me make my choice"
754,"Thank you, Luke! How can I run windows version of MS Excel and Power BI on MBA M1? I need to use power query and it looks like it’s not available on Mac’s version of Excel."
755,tks a lot for your sharing
756,"once again you&#39;ve gave direct answer I for exact match question I was wondering about , keep it up, Luke"
757,thanks bro this helped me decide between the two
758,Would MacBook Pro 13&#39; will be enough for students who are studying data science in college?
759,"Hi, thanks for the video. I&#39;ve been wondering - if I purchase the air and upgrade to the 16GB RAM, won&#39;t there be a bottlenecking issue (will the available RAM actually be less than 16GB)?"
760,Could you please tell me that should I go for MB air (16/512) 8 core GPU or MB pro (16/256). I am beginner in programming and also I&#39;m gonna use it for photo editing and mild video editing.
761,"Luke.. you should teach other YouTubers how to respect own viewers. I’m shocked for how many questions you answered, big respect and no ego! 🤝"
762,What would you recommend for computer vision and ml
763,Dose tableau work in M1 ?<br>Thank you
764,I am a Neuroscientist I use some python a lot of R and SPSS for my own research... I also run big huge files of climatic data for a side job to correlate with geographic and animal distributions.. what do you think o the New MacBook Pro M1 PRO and MAX (October 2021)?
765,"You&#39;re just reading documentation on video,lol"
766,Tell me please. Did I understand correctly that 8 gigabytes will not be enough to work comfortably with 5-10 tabs in Google Chrome + PyCharm?<br><br>ps. I want buy Mac Mini
767,"Hi, I will work with analysis of data, python, .NET/C#, also basic statistics and data manipulation, I usually have a lot of tabs open, using android studio, visual code, but i don&#39;t know which one to choose, can you help me please?"
768,"What about the high SSD writes?  I’ve been waiting until there’s a 32gb RAM option because of the projected 2 to 3 year lifespan of the SSD.   My logic was less RAM, more swap, more RAM, less swap used."
769,"I love it! Yes, 1-2 minutes would be perfect."
770,"You were not kidding about &quot;shorts&quot; :xP , it is way too short. Please make it like 1-2 mins atleast so that its easier to follow"
771,"If you&#39;re getting the M1 Mac check out this video to help decide between the Pro and the Air: <a href=""https://www.youtube.com/watch?v=xzR4L_XYW3g"">https://www.youtube.com/watch?v=xzR4L_XYW3g</a>"
772,"It&#39;s been a year now. Curious, as a data science student should I go for 16gb M1 MBA or the 14 MBP base model."
773,"Hey Luke ! This video is really helpful. I have a question though. How good is the MAC when it comes to Pyhton Deep Learning such as Image classification, neural networks, etc. ?"
774,Hello there Mr Barousse.<br>I wanna order a new MacBook with m1 chip. But it&#39;s important for me that I can run Bioinformatics programs specifically GROMACS. Could you please help me and check out that Can I run GROMACS on m1 MacBook?<br>Best regards
775,Thanks for the video. Any updates on Tableu and Power BI compatibility with the M1? I’m looking to get on for an MSBA starting in January
776,"What about Stata, R and Python? I&#39;m economics student"
777,"Hello Luke, could you teach me how to install power bi in M1 Pro &amp; R, tableau, please! thank you so much"
778,"CE here, just want to clarify… silicon  is pronounced sili-Kin. Sili-Cone is a rubber like plastic.  Silicon vs silicone."
779,"I am curious if this suggestion has changed at all and what, if any, is changed with the new M1X and the ability to have more than 16GB of RAM in the MacBook Pro now.   My son is in college and he is studying data science and has had a MacBook Pro (Intel) that is around 6 years old and I was debating giving him my 16&quot; Intel MacBook Pro from last year or getting him another computer.   I look at the current AMD/Intel Microsoft Windows laptops but honestly they seem horrible when compared to the new M1X laptops.   I am just curious how significant running Microsoft Windows still is for a Data Scientist in todays world."
780,I wonder how it compares to an i9 intel mb pro?
781,"Thank you so much for your Content.<br>I’m beginner of data science course . <br>How do you think MAC M1 suitable for Data science ? <br>( deep learning , machine learning )"
782,"I pretty enjoy working on the M1 MacBook Pro but I also hate it because the Mac version Excel doesn&#39;t come with the POWER SUITS (query/pivot/map). <br>On the other hand, I like to use XLWINGS to automate some procedures with Python. Due to the fact that different api was called on Windows PC and Mac OS (win32 versus appscript), the way you call each method and attribute are also different. XLWINGS official documentation doesn’t provide a complete tutorial on how to use XLWINGS on Mac OS. <br>Both of these reasons made me turn back to Windows PC."
783,"I’m data engineer. So I use tools for data viz, data analysis(python, scala) and etc. do u think it’s okay to buy macbook pro m1? Can m1 handle it?"
784,"Hey Luke..great review..<br>I just want to know which would be the best option for data science .all the software like tableu ,R ,apache spark etc all which are used to learn data science.<br>M1 or intel i5 or ryzen 7"
785,"I feel like lack of M1 support for Python, Tableau, Power BI, and R Studio makes this not ideal.  Perhaps I don’t understand clearly how Resetto works by mimic-ing an intel chip, but that seems like there’s some virtualization going on which could be another layer of complexity."
786,you can use parallels on M1 machines to run vm machines and adopt windows features on your research
787,Hello my irani please add language iran(Persian )  to translate your video tanks 💙💙
788,"Hi Luke, thanks for uploading this informative video. In terms of some libraries used in python but do not work properly on m1 MacBook. Do you have any issues installing scipy or seaborn under python apple silicon? Thanks."
789,"This right here. THIS is THE video I was looking for and I absolutely needed.<br>I’m currently an undergraduate Finance student, and I’d also love to learn basics to start diving into Fintech world and build a career. Who knows.<br>I read a lot of negative opinions about the performance of Excel on M1 but no proof. In the end I’m just a beginner. I have trust in what I have just witnessed in this video, perform basic operations and functions with Excel program and light coding is what I need at the moment.<br>The main problem I encounter too often with Windows laptops is the pairing with all my Apple devices – what a pity. Maybe I’ll get one in the future for work, like you did. But for my usage and level, I guess I’ll just need the bare minimum.<br>This video was vital for my definitive choice.<br>I’ll get the MacBook.<br><br>I’ve also just started to give a look at your YT channel. Amazing quality videos, aesthetic and appearance. Very interesting contents.<br><br>Here you go. A new subscriber. Thank you so much for the work you do and the passion you put in it. Greetings from Italy!"
790,Will apple macbook pro m1 be good for machine learning
791,"Hi Luke, I like your content ! Can I add you on LinkedIn ?"
792,"Best and straight to the point explanation,thanks"
793,Did I miss your mention of Book you recommend?
794,"Hello Luke, i really enjoy your videos and you really inspired me to learn excel and sql. I got a question, do you need to be proficient in coding to become a data scientist?"
795,Luke do recommend learning Data Structures and Algorithms + Design Patterns if you&#39;re interested in a data related career?
796,You look like Mark Zuc when you speaking kk
797,Django or D-jango
798,"Good video but everytime that he says D—jango, I cringe"
799,Loved your intro
800,Any book recommendations for beginners?
801,This ideas are like a fresh sip of ORANGE juice!
802,You have great posture (no homo).
803,Contributing is a great way to learn. Ie teaching. Great point
804,Waahh what a fantastic video man suuperb
805,this is exactly how I feel somedays but I keep pushing though I&#39;m in a bootcamp right now so I kinda have to keep plugging away atleast I don&#39;t get that frustrated just kind of down.
806,This looks like Kalle Halden’s older brother
807,"Oh Django is a steep learning curse, especially for a beginner!!"
808,Grt Video.......&amp; I hope you hv got sponsors now.... :)
809,"Could you share your suggested reading list, please?"
810,You got yourself a sub. Thanks
811,"One important thing you didn&#39;t talk about is having a specific field you&#39;re interested in. In my case, I am a geographer and I learned python in relation to spatial data analysis. It helped me keep focused and interested"
812,"Hey Luke, thanks for all your content, just wanted to leave my message that you are a great motivation for a young Brazilian with seventeen years old, looking to improve every day. Success always."
813,Just finish this Series. It was very helpful. I have never understand Python this much clearly by any video. Thank you very much. Highly appreciable.
814,"This is great, thanks you"
815,"Hi Luke, thanks for this series really enjoyed working through the problems. I have noticed that part 6 doesn&#39;t have a Jupyter notebook for it on Github, any chance it could be shared?"
816,"I love it, thanks for your help."
817,Is this series discontinued?
818,KEEP THIS UP - I love it my man
819,Hi Luke - I&#39;ve just got to your channel and I&#39;ve already watched more than 10 videos. Its been really helpful please keep this up. Looking forward for more videos from you. Thank you for sharing your knowledge. Kudos to you mate!
820,Thank you so much I learned python in just 5 videos! I hope I become a data scientist like you
821,Thanks so much for this! Greetings from Brazil.
822,Please make more tutorials i love these pls complete the series with other libraries as well
823,"Congratulations on the first thousand subs. I have a feeling this will escalate!<br><br>By the way, your presentations are uncommonly great for tablet viewing - very clear, legible and concise."
824,Super helpful!
825,2nd time subscribing for some reason.
826,"This is a well made tutorial. I liked the presentation very much.<br>I found that when trying to create a list with numbers from 1-100 using the range function, the correct expression would be range(1,101) since the last number i.e. 101 is not included. <br>range(100) would give you a list from 0 to 99 only, i.e.  0,1,2,3,4,5.....95,96,97,98,99"
827,"Wow, well done I am going through a lot of Python tutorials but believe me your way of teaching is far better than all of them. Thanks a lot please keep making these tutorials you are doing great job."
828,Beautifully done!
829,"Good content, are you planning for pandas and numpy videos?"
830,"Hello Luke, when I execute the commands to obtain the list of all lines (in your tutorial you run those command at minute  <a href=""https://www.youtube.com/watch?v=NnfbVOt9IR0&amp;t=19m35s"">19:35</a>), unfortunately the first line that comes out is from episode 3 (&quot;Good luck. [closes door and locks it]&quot;).   :( :( I tried and tried to understand why, but without success. Where does this issue come from? Thanks in advance..."
831,great
