,0
1584,We do academic writing..DM for more details
1585,"Flatten the curve - Delay herd immunity.<br>Save the NHS - Don&#39;t go to hospital.<br>Stay Safe - Be Afraid.<br>Stay Alert - ??<br>Social distancing - Anti-Social Isolation.<br>Cases - Positive PCR Test, known for false positives.<br>Comorbidities - Had other illnesses.<br>Lockdown - Tyrannical Care.<br>Wear a mask - Conformity is now virtuous.<br>Not wearing a mask - Selfish/Rebellious.<br>Furlough - Hide the destroyed Economy with our money.<br>V shaped recovery - Yeah, Right!<br>Curfew - A gauge of psychological control. Taking the Piss.<br>Bubble - Taking the Piss.<br>Rule of Six - Taking the Piss.<br>Second Wave - Don&#39;t Relax Yet!<br>New normal - New World Order"
1586,BBC is well known to be the king of conspiracy
1587,BBC directly founded by Britisher forigen department.<br>They always up to date with propaganda.
1588,"U can show some good images of that country, although Pakistan is not that much ugly.<br>As India we can understand western propaganda while Showing news about East."
1589,"The Quraan and modern science <a href=""https://youtu.be/cPkDQvmDviQ"">https://youtu.be/cPkDQvmDviQ</a><br>Prophet muhammad (pbuh) prophesied in the Bible <a href=""https://youtu.be/3PyAiv92XjY"">https://youtu.be/3PyAiv92XjY</a>"
1590,"<a href=""https://www.youtube.com/watch?v=HaHuTNh8fAo"">https://www.youtube.com/watch?v=HaHuTNh8fAo</a>"
1591,Well there are going to be a lot more deaths and paralysed kids after kill gates vaccine
1592,"<a href=""https://youtu.be/fKlvwPRh-ok"">https://youtu.be/fKlvwPRh-ok</a><br><br>Do you think you are born again just because you go to a church?  Not all churches declare the Truth. On the contrary, your church could be a completely worldly church. For your own soul, you must come out of the churches that use the Bible but do not declare the Truth and speak lies differing from the bible. Hear what the Spirit of Truth says to the churches and receive the eternal gospel!!"
1593,"World Health Organization had to admit that their polio vaccines have caused a polio outbreak in Sudan, it’s hardly a conspiracy - <a href=""https://www.who.int/csr/don/01-september-2020-polio-sudan/en/"">https://www.who.int/csr/don/01-september-2020-polio-sudan/en/</a>"
1594,BBC IS FULL OF SHIT<br>NO ONE ELECTED BBC YET   IT CLAIMS TO REPRESENT AND BULLY  PEOPLE AND EXTORT MONEYF FROM THEM<br><br>NO MORE TV LICENCE
1595,"So these kids with polio, actors employed by the BBC are they? Funny how polio only hangs around in regions where kids don&#39;t get vaccinated."
1596,"<a href=""https://play.google.com/store/apps/details?id=com.Yoncagames.PirateJoe"">https://play.google.com/store/apps/details?id=com.Yoncagames.PirateJoe</a><br>Super mario"
1597,They have nukes atleast
1598,"If you’re reading this comment now! Your financial freedom is here!<br><br>Solution investment is changing lives with one time investment! The main aim of the solution investment is to ensure all members are financial independent. Earn PASSIVE INCOME!<br>Solution investment offers you an opportunity to earn by joining the compensation plan, you get paid on a WEEKLY basis (every Mondays) ranging from $10,000 to $1,000,000,00<br><br> DM for more info NOW!<br>Telegram: +447380359969<br>WhatsApp: ‪+14242413176‬<br>Email: solutioninvestmenttradingline@<a href=""http://gmail.com/"">gmail.com</a><br><br><br>Yes yes yes yes yes yes yes yes yes yes yes"
1599,"I really don&#39;t understand how they can lie for satanic freemason paedophiles click the link and skip to 8 mins 9 secs  <a href=""https://youtu.be/c0XZlgkYBHc"">https://youtu.be/c0XZlgkYBHc</a>"
1600,"I really don&#39;t understand how they can lie for satanic freemason paedophiles <a href=""https://youtu.be/c0XZlgkYBHc"">https://youtu.be/c0XZlgkYBHc</a>"
1601,What the hell<br><br>Why are you killing aid workers
1602,"Appreciate BBC to bring this issues, praying for the Government to focus on  innocent children&#39;s, Please Help International community to help this Government."
1603,Check out Vernon Coleman on his brandnewtube channel and hear what Emma Barnett has to say about BBC policy and anti-vaxxers.  The BBC is an ememy of the people. BAN THE BBC!!!!
1604,Defund the BBC.
1605,"BBC are ramping up the propaganda in preparation for the Covid vaccine arrival I see....how predictable. Sure, historically vaccines have saved countless lives. But the unavoidable objective fact is vaccines have also killed and harmed a huge amount of people, and those are the vaccines that have not been fast tracked as the Covid one has, whenever it emerges."
1606,Not worried at all its just another planned excersise to push the NWO 2030 agenda
1607,The corona crime
1608,Well if its on the BBC then its definitely a lie …do not watch the state propaganda and stop paying the TV licence now … !!!
1609,I’ve been hearing that the WEF “cyber attack” target banks this year…
1610,They are Currently shutting down the Economy.<br>Cyber Attacks will commence very soon. We are due Elimination but our government is not saying nothing. <br>Get your home&#39;s in order NOW and Supplies NOW
1611,Cyber attacks? Who gives a shit? Just go for a walk outside.
1612,They predicted the big event in 2022. Im from the future.
1613,The US government doesn&#39;t know anything about &quot;Chinese cyber-attacks&quot; - they simply claimed there were cyberattacks without any evidence. Something like this happens now every day in the US.<br>&quot;Biden dodges questions about China cyberattacks.&quot;  (YouTube)
1614,Next agenda by the elite satanist scum. Prepare people
1615,"Funny that, never had any significant Cyber Attacks until Klaus Schwab starts rambling on about it, and then low and behold, as if by magic they are starting up in different countries. I smell a rat."
1616,"Yeah let&#39;s go online (where cyber hackers live) and explain which economically &#39;essential&#39; business vectors are vulnerable, by stating just how easily hackable they really are, oh!  and here, almost forgot, here&#39;s a video aide to assist with your kids&#39; crazy vidyea gaymz"
1617,If it&#39;s deadly then very worried 😲
1618,Mark of the beast
1619,The answer is go back to life without the internet! Things were built much better then and are still around today unlike most things built since then.
1620,They are telling you they have it planned.
1621,This is subliminal conditioning for children and young adults
1622,"If people knew how to hunt &amp; grow food, live off the land like our forefathers this wouldn’t effect shit, but they’ve made you dependent on their system. People are dumbed down, lazy &amp; self absorbed."
1623,With creepy joe and Harris at the helmet we are not looking good.
1624,"Theyy are using propaganda like this to condition you for their cyber pandemic they are planning, same thing with covid 19 then they siumulated it and the events to follow in oct 2019 event 201.       This is only year 2 of a 10 year plan , things will get much worse, they use fear to control the masses."
1625,"Predictive programing, agenda 21, food suppliers attack, meat under attack. Complete control of the food supply."
1626,We’re already in a Cold War with China. How do people not see that?
1627,YERLERİN VE GÖKLERİN VE HERŞEYİN SAHİBİ YÜCE ALLAH çin doğu Türkistan kardeş lerimizi zülmeden zalim bir terör ve işgalci devleti çin yok olmaya mahkumdur ALLAHIN İZNİYLE zalimler için yaşasın cehennem
1628,Wow this was filmed in Downing College
1629,China is using the British Empire as a roadmap.
1630,The best thing that us can do is get out of debt and take care of it&#39;s own country and defend it&#39;s own borders and strengthen it&#39;s allies and form peaceful foreign relations with foreign countries. Just mind it&#39;s own business.<br>I believe that this video is correct that it is already too late to do anything about it except for nuclear war. Which China could probably survive anyway
1631,The us cannot afford to lose business with China. We probably already have to some degree.<br>Trumps tax hike on tariffs did NOT HELP matters. Hence Biden. Biden has more foreign policy and relations experience to deal with China. Trump is not capable of dealing with China in a way that secures us interests.
1632,The us keeps playing cold war war games. Us propaganda accuses china of the corona virus. <br>China is too powerful for the us.<br>The us also owes most of its debt to China.<br>China can largely ignore most of the us propaganda and us tactics.<br>China has not really done anything wrong. They are NOT at war with anyone and all they are doing is expanding their business interests with other nations. Only the us has engaged in war crimes against other smaller countries to expand its interests.
1633,"Ben Ellery and Tom Knowles, so called news reporters, are actually very dishonest poeple. What a disgrace to the news industry! How low can you go, The Times."
1634,Covid was developed as a biological weapon...we are already at war...
1635,YERLERİN VE GÖKLERİN VE HERŞEYİN SAHİBİ YÜCE ALLAH çin doğu Türkistan kardeş lerimizi zülmeden zalim bir terör ve işgalci devleti çin yok olmaya mahkumdur ALLAHIN İZNİYLE zalimler için yaşasın cehennem
1636,"EVERYONE listen to xi jinpings speach they manipulate everything he&#39;s saying, he&#39;s just talking about everyone working together"
1637,"Have you ever tried forex bitcoin investment trading and failed?  Yes I tired in the past and failed until I meet Mr Dennis @Dennis_forex09 who convinced me to trade with his platform.  And today it&#39;s a decision I never regretted.@Dennis forex09 on instagram today and start earning $20,000 within a period of 6days. ❤️"
1638,How can US offer for co-existence with China when Beijing already took control of South China Sea with its marine &amp; energy resources &amp; have set restrictions on strategic water ways??? Maybe these media personality &amp; political figures are so naive or just too dumb to percieved not seeing that China wants to dominate them all. PATHETIC....Hahaha!
1639,No cold war? Its clear this was an act of war what they did to the US. They better pray Trump loses.
1640,You have time to worry about the rise of China but don&#39;t want to spend time on the development of yourself
1641,Well no one&#39;s talking about the re-education camps for Muslims in China
1642,中国需要从地图上抹去
1643,with tik tok as well as chinese investment in africa with more distrust of trump china is leading so far
1644,lol tik tok and chinese goods/services are already the tip of this cold war
1645,"World rape Olympics champion 🏆 is<br>Uttar pradesh, India🇮🇳"
1646,Any again tier 4 lockdown get in
1647,"The sad truth about lockdowns!! <a href=""https://youtu.be/mYs2WgHX8Sk"">https://youtu.be/mYs2WgHX8Sk</a>"
1648,The sad truth about lockdowns !!
1649,"All thanks to Dr godfather for helping me to  bring back my husband, I was heartbroken when my husband told me is over between us for three years, one day I was on the internet when I say a testimony about a great spell caster called Dr godfather, how he help a woman to bring back her husband who was divorce  for  5years, so I also contacted Dr godfather he told me all I need to do and I did as I was told, he also told me within 3days my boyfriend will be back, I was so surprise to see my lover begging me that he is so sorry, I&#39;m so happy my boyfriend is back to me, if you are in need of any kind of spell casting you can also contact him today on his email drgodfatherspellcaster1 @<a href=""http://gmail.com/"">gmail.com</a> or WhatsApp him +2347062606817<br>Dr Godfather can also help with with the following<br><br>1 LOVE SPELL<br>2 WIN EX BACK<br>3 FRUIT OF THE WOMB<br>4 PROMOTION SPELL<br>5 PROTECTION SPELL<br>6 BUSINESS SPELL<br>7 GOOD JOB SPELL<br>8 LOTTERY SPELL<br><br>YOU CAN CONTACT HIM NOW AND GET YOUR PROBLEM SOLVED email: drgodfatherspellcaster1@<a href=""http://gmail.com/"">gmail.com</a> or WhatsApp: +2347062606817"
1650,"Usual joke no one is actually locked down you can travel elsewhere, the pub I work at in North yorks was like anfield on a match day today 🤣🤣🤣 <a href=""http://www.youtube.com/results?search_query=%23boris"">#boris</a> and his comedy club 😂😂"
1651,"Greetings! Welcome to The Illuminati World. Bringing the poor, the needy, and the talented to the limelight of fame and riches. Get money, fame, power, and security. Get recognised in business or politics. Rise to the top in whatever you do, and be protected spiritually and physically! All these you will achieve in a twinkle of an eye when you get initiated into the GREAT  ILLUMINATI EMPIRE you will have numerous benefits. Are you interested joining Illuminati, if you are interested contact us now on WhatsApp +63 961 583 0730"
1652,"HOW I GOT CURED FROM HERPES VIRUS . I was suffering from HERPES VIRUS and i have  tried all I can to get cured but all to no avail,,until I saw a post in a health forum about a herbalist man Dr osaba who prepare herbal medications to cure all kind of diseases including HERPES,at first I doubted if it was real but decided to give it a try,when I contacted this herbalist Dr osaba via his email and he prepared a herpes herbal cure and sent it to me via UPS delivery company service, when I received this herbal medicine, he gave me step by direction on how to apply it,after applying the way I was instructed,I was totally cured of this deadly illness  called TINNITUS, all thanks to Dr osaba you can email him now drosabacurehome@<a href=""http://gmail.com/"">gmail.com</a> or WhatsApp him on +2348132322488  HE CAN ALSO CURE SICKNESS LIKE<br>{1}HIV/AIDS<br>{2}DIABETES<br>{3}EPILEPSY<br>{4} BLOOD CANCER<br>{5} HPV<br>{6} ALS<br>{7} HEPATITIS<br>{8} SKINBIS  <br>{9} SICKLE AND ANAEMIA.."
1653,people who deny the corona virus are usually the ones wha are very often superspreader. I cant understand anyone complaining about the strikter rules to cope with the very high infectionrate.
1654,That is the stupidest thing I&#39;ve ever heard! You have families and households that they do not want mingling but it&#39;s okay for someone to go to a bar as long as they adhere to the restricted curfew hours? What&#39;s wrong with this picture people? That is just absolutely stupid it&#39;s almost as stupid as quarantine people in New York City per there zip code! What? you really think people are going to stay within their own ZIP code when they quarantine. And this is why there restrictions and their laws concerning this virus are not going to work as they make absolutely no sense whatsoever. Look I hate wearing masks like everybody and if wearing them means it&#39;s going to help to slow down the virus or help to make it go away then wear the stupid mask people. It has nothing to do with politics and this has nothing to do with your civil rights.... it&#39;s simply there helping to get rid of the virus.
1655,"Have you ever tried forex bitcoin investment trading and failed?  Yes I tired in the past and failed until I meet Mr Dennis @Dennis_forex09 who convinced me to trade with his platform.  And today it&#39;s a decision I never regretted.@Dennis forex09 on instagram today and start earning $20,000 within a period of 6days. 💝"
1656,bbc = fake news
1657,Lies
1658,"All thanks to Dr godfather for helping me to  bring back my husband, I was heartbroken when my husband told me is over between us for three years, one day I was on the internet when I say a testimony about a great spell caster called Dr godfather, how he help a woman to bring back her husband who was divorce  for  5years, so I also contacted Dr godfather he told me all I need to do and I did as I was told, he also told me within 3days my boyfriend will be back, I was so surprise to see my lover begging me that he is so sorry, I&#39;m so happy my boyfriend is back to me, if you are in need of any kind of spell casting you can also contact him today on his email drgodfatherspellcaster1 @<a href=""http://gmail.com/"">gmail.com</a> or WhatsApp him +2347062606817."
1659,"I was infected with Herpes virus, and we started taking medication for us to live healthy. There was a day I went online and searched for a cure for our virus, I saw many comments and many post until I saw a testimony about Dr Osaka and how he helped so many people get cure to their virus on the site. I contacted him and told him how i and my wife got our Herpes virus, he told me what we will have to do, which we did.After he finished, he told me that we will take his medication for a week which we also did so and 2 weeks ago we went for test and surprisingly i and my wife are now HIV negative. I am so happy that I got my wife infected and I also made him negative. All thanks goes to God for bringing Dr Osaka my way and at this point if there&#39;s anybody who is infected and you think there&#39;s no way of making yourself negative again I must tell you, that&#39;s a lie because Dr Osaka will make you negative again. contact (drosakaherb@gmail) or contact His  Whatsapp +2348136574975 there for you Thanks to Dr Osaka<br><br>He can also cure<br><br>Herpes virus<br><br>Gonorrhea<br><br>Low sperm count<br><br>Skip disease<br><br>HIV / AIDS<br><br>Arthritis<br><br>HERPES 1/2<br><br>CANCER<br><br>ALS (Lou Gehrig&#39;s disease)<br><br>Hepatitis B<br><br>chronic pancreatic<br><br>emphysema"
1660,🤔
1661,How can people not want to follow restrictions? Its not a choice this has to be done! Is it me or is the whole world going crazy?
1662,"<a href=""https://www.youtube.com/watch?v=hi8xKwaoPRk&amp;t=06m35s"">06:35</a>. Really ? You wear winter coats and gloves already ? Greetings from Norway 😅"
1663,The BBC is at war on the British.
1664,"What happens in GB and Germany and all over the world, exept in  Sweden, Belarus, Tanzania and Madagaska, is verry simple:<br>Sham democracy governments + sham leadership elites + sham leadership media<br>THE CHANGE<br><a href=""https://www.youtube.com/watch?v=4Ma9Spq7uG0"">https://www.youtube.com/watch?v=4Ma9Spq7uG0</a>"
1665,"I want to thank Dr godfather the great spell caster for helping me to being back the love of my life, are you in need of your EX back or you are looking for   any spiritual man to work for you, do you want to become rich and famous or do you want your business to be growing  or are you looking for the fruit of the worm contact Dr godfather on WhatsApp +2347062606817 ormail e-mail drgodfatherspellcaster1@<a href=""http://gmail.com/"">gmail.com</a>"
1666,"The wording of English journalism sounds soooo childish….like every video uses “dead”<br><br>Like one video read, “Police shoot dead Terrorists”……..<br><br><br><br>👀"
1667,yawn
1668,I got out of my cuffs in the back of a police car. It’s not hard.
1669,🤣🤣🤣🤣👍👍👍👍
1670,Another News story leaving us all confused
1671,Was it ever determined how the revolver that killed the officer got into the station?  How did the officer get killed if the suspect was handcuffed? Why was the revolver not found during the search of the suspect?   This story seems to have fallen below the radar.
1672,Next
1673,"This is bulshit because they frisk and search you before they take you in custody, so most likely police officers killed each other and they are hiding that, there’s no way you can hide a gun mate."
1674,Bullshit
1675,3 months later.. any updates?
1676,Hhhh very good  all police officers should been kill
1677,"Come on.!! How does a suspect in police custody shoot a police officer with a concealed gun whilst handcuffed behind his back .  Is he a born again Harry Houdini, or is this a massive cover-up ??. C. B. G."
1678,Something terribly fishy about this apparent killing.....
1679,"Hi i am are working on coronavirus from January 2020 when I come to know about this virus in dec 21/12/2019 from one of my Chinese female friend. We both collected too much data technically and non technically in both ways .In February only we understand the severity of this virus just because of it&#39;s mutancy, data which we collected till now is as good as  just like we predicted  future. initially in our research we found that propolis of Brazil having much better Ingredients Available which help for covid-19 patients for best treatment and after studying all the related subjects required to found some fruitful result. On 16/10/2020 we come across a theory of called &quot; five circle theory&quot; which if any human body doing he will never be cause any serious damage to cell the fundamental unit of life till antibodies not developed which are as follows .<br>1.10 minutes sunlight.<br>2.Daily use of ginger.<br>3.Four diets of green leafy vegetables in a week. <br><a href=""http://4.eat/"">4.Eat</a> any one fruit daily.<br>5.Take oxygen from nose and push it out from mouth. <br>This theory is discovered by us after a deep study in which we consider coronavirus not as a virus but as a new subject in which we started from zero.<br>May be you think that this &quot; five circle theory &quot; is not new but this is also true that when vaccine and medicine are not a part of human then also human life survive ,during the study of coronavirus Ayurveda data was so much helpful for us and this theory challenge all the humans which tell that we follow this &quot;five circle theory &quot;  but still we are having covid-19. And we appeal to you that if you and your team will discuss on this topic so it will be more helpful for all human life , each and every human have certain life and all the humans are made of elements like calcium, magnesium, iron etc .  But this also true which we cannot deny that science and many theory increased the LER ,The nature  provides us all these things but we forget that , even we forget that only because of plants we human survive , we all get food from plants , in this earth no one is having capability too produce food for human.<br>The &quot;Five circle theory &quot; is a result of very deep thinking, deep study , collection  of too much confidential sources and explored many hidden truths and also not to tell but sacrifice our family valuable time."
1680,No BIG loss just a DEAD PIG pleantley more on the farm to replace him I&#39;ll have a WANK  in his momory
1681,"Shot by a man known to Police, who HAD been searched and was also handcuffed with his hands behind his back. Does this make any sense? How is it even possible? It isn&#39;t, the suspect obviously had help, and seeing as the only people in the custody suite were police then it must have been police that helped him. Which does make sense and is far more likely than the nonsense coming out through official channels. The witness/es must have already indicated that the suspect shot himself otherwise how has that story materalised? Hopefully it&#39;s not just an assumpton by the police who persumably were the first ones on the scene. I can&#39;t wait to see how Police are going to wiggle out of this one. My bet is the suspect doesn&#39;t survive long enough to stand trial in front of a full jury. The murder looks like a manchurian candidate (the patsy) gangland style execution to me. Police are the biggest gang on the streets. Why was Sgnt Ratana retiring at 54? Why did Ratana think the &#39;safest&#39; thing he could do in his last 3 or 4 months of service was to work inside, as indicated by a friend? Had he been threatened outside? Obvious questions I&#39;ve not heard asked anywhere. You&#39;d think the media would be all over this but they&#39;re not. It happened about a month ago and all that&#39;s happened since is a suspected supplier of the weapon has been arrested. Could this be because Police already knew who supplied it? Maybe under cover police actually bought it."
1682,So sorry to hear this. May Allah grant him Jannah.
1683,This is a bit strange.....
1684,"Hello, I only wanted to say that I really liked your content 😃<br><br>This is my friends channel, please listen to his music and watch his videos, after that You can decide whether You&#39;ll subscribe or not, he really deserve it:  <br><br><a href=""https://www.youtube.com/channel/UCC3U2oGfbQD6uH3YNiqFVCw"">https://www.youtube.com/channel/UCC3U2oGfbQD6uH3YNiqFVCw</a>"
1685,And like Private Lee Rigby the media will conviently forget this guy too. Yet the name of a career criminal will be kept alive.
1686,"Watch a video on vaccine geopolitics and support this channel by subscribing <a href=""https://www.youtube.com/watch?v=C3nnj2D2eB0&amp;t=36s"">https://www.youtube.com/watch?v=C3nnj2D2eB0&amp;t=36s</a>"
1687,"Any old nonsense to make the word &#39;nationalism&#39; sound negative, eh BBC?"
