,0
1234,"Not gonna lie I’m Tamil and Sri Lanka has improved in the push for free education but in reality it is incomplete. Village people tend to lack education in comparison to cities. And though Tamil people do have free education, they are in certain instances subjugated to social inequality. Still stories like these show the youth is getting more benefits in education as we near the future. People who say sri Lanka has free 100% education need to take a closer look at what this theory does in practice."
1235,Fake news
1236,"Such a fake news, in Sri Lanka education is free for everyone, regardless of race or religious believes. <br><br>BBC Stop doing fake NEWS."
1237,She is such an inspiring Women. Wish her all the best!
1238,when we&#39;d fluffy all shaved with chai latte cloth I&#39;s
1239,Sri Lanka has free education. Don’t make a bad image about Sri Lanka.. the most of tea estate workers are don’t like change their life system.. that’s why they work as a tea pickers.. after their work you can see all tea pickers going to the bar and buy arrack.. husband and wife drink together.. that’s their life system.. they don’t want their children’s education.. when their kids become a teenagers they also marry and doing like their parents.. bbs don’t make fake news ok.. first come Sri Lanka and look our country situation..
1240,Why are they all blacks
1241,"I am so happy Dr Abiola has make me to be happy Dr Abiola was able to cure me totally from HIV disease with his natural roots and herbs he sent to me after two weeks of usages I went for a check up and when the result was out it was negative you can get in touch with Dr Abiola if you are suffering from HIV disease so that he can also cure you totally as he did mine via email drabiolahome@<a href=""http://gmail.com/"">gmail.com</a> or message him on whatsapp +2348163587231  I am so happy Dr Abiola has make me to be happy Dr Abiola was able to cure me totally from HIV disease with his natural roots and herbs he sent to me after two weeks of usages I went for a check up and when the result was out it was negative you can get in touch with Dr Abiola if you are suffering from HIV disease so that he can also cure you totally as he did mine via email drabiolahome@<a href=""http://gmail.com/"">gmail.com</a> or message him on whatsapp +2348163587231 kk"
1242,Thanks God they are building them back otherwise Britishers almost have distroyed them.
1243,Great
1244,"The Quraan and modern science <a href=""https://youtu.be/cPkDQvmDviQ"">https://youtu.be/cPkDQvmDviQ</a><br>Prophet muhammad (pbuh) prophesied in the Bible <a href=""https://youtu.be/3PyAiv92XjY"">https://youtu.be/3PyAiv92XjY</a>"
1245,“Tea pickers didn’t came here”               They were brought by the British to use as cheap labor .                                                       Until now  they are used as cheap labor with a cheap life.
1246,"Wow .. this timeline evidence of the Obamagate Biden scandal is incredible ! <br><a href=""https://wsau.com/2019/12/03/bombshell-the-obama-administration-stole-about-7-billion-dollars-through-ukraine/"">https://wsau.com/2019/12/03/bombshell-the-obama-administration-stole-about-7-billion-dollars-through-ukraine/</a>"
1247,He said the truth  that s why demicrat afraid of him
1248,I love Donald Trump tell you the truth
1249,Biden&#39;s is mentally aged and touchy-feely approach with females isn&#39;t comforting.
1250,"I am glad I am not American and I don&#39;t have to vote for one of them... Seriously, I don&#39;t even know who is worse!"
1251,“The election of Donald Trump did not create the left’s hate.... it revealed it.”
1252,Now this is my type of comedy
1253,They are just a representation of what America has become. Child-like.
1254,"<a href=""https://www.youtube.com/watch?v=H_dMoAdRgPc"">https://www.youtube.com/watch?v=H_dMoAdRgPc</a>"
1255,"You are not news but pure unbiased propaganda, let truth and decency destroy you"
1256,"&quot;American Veterans, Current Military &amp; Families&quot;<br>                                                 As of: 10,1,2020 <br>                                      Donald Trump &amp; His Administration...<br>                                        &quot;LIED&quot; &amp; KNOWINGLY ALLOWED&quot;<br>                                          &quot;211,833&quot; AMERICANS TO DIE&quot; <br>                                                &quot;FROM CORONAVRIUS&quot;<br><br>                                 &quot;Trumps thoughts &amp; comments on America&#39;s Military...<br>               Trump allowed Russian Bounties on American Military with no consequences<br>                       (The U.S. would retaliate if bounties on U.S. troops were true<br>            (not taking intelligence information concerning soldiers deaths seriously<br>                             (Trump quote on Russian Bounties---Aug 20,2020)                                     <br>                        Asked wounded veterans be kept out of military parades <br>                  Refused to visit military cemetery in France because it was raining<br>                            Took four collage deferments from 1964 to 1968<br>                       When those deferments ran out, in 1972 Trump then took a<br>                                   1-Y medical deferment due to (bone) spurs<br>                                                 &quot;Trump on (bone) spurs...<br>                 “I had a doctor that gave me a letter, a very strong letter on the heels,” <br>                      &quot;It was not a big problem, “Over a period of time, it healed up,”<br>            (Trump kept his 1-Y status until 1972, when he became 4-F and was permanently <br>                                      disqualified from military service in Vietnam)<br>                                 &quot;58,214 Brothers &amp; Sisters were killed in country&quot;<br>                              Over 1,626 Americans missing &amp; Still Unaccounted for<br>                                            Vietnam Veterans &amp; America<br>                                              Who do you think our lost<br>                                                 Servicemen &amp; Woman<br>                                                      Would Want You<br>                                                         To Vote For<br>                                               &quot;Another Thing...<br>                                                  &quot;America&#39;s Military are not&quot;<br>                                                      &quot;LOSERS &amp; SUCKERS&quot; <br>                                         &quot;You draft dodging lying chicken sh%t&quot;<br>                                               I implore every Vietnam Vet to...<br>                          &quot;Vote Trump &amp; his administration out of office this November&quot;<br>                                                           Or the next <br>                                        &quot;Loser may be YOU or A Family Member&quot;<br>                                                            P.O.W. M.I.A.<br>                                                            Never Forget.."
1257,I almost didn&#39;t watch can&#39;t stand chris he a liberal and sleeping joe he got that smile that looks like a kids that stole something are being dishonest
1258,BIDEN TOLD SO MANY LIES !!!
1259,"You just lied when you said it LIAR, RACIST, SOB!"
1260,!!!!! GOV. CUOMO FOR PRESIDENT !!!!!
1261,"@All so called  NEWS&#39; Media in the Word and All Politicians and the Puppets that control them : <a href=""https://www.youtube.com/watch?v=5TuJ8Pjk9Sw&amp;t=4s"">https://www.youtube.com/watch?v=5TuJ8Pjk9Sw&amp;t=4s</a><br>Fxxk You !!!"
1262,"A politician who works for a people,Trump!!<br><br>That&#39;s character.<br><br>A politician who works for his own benefit,Biden!!<br><br>That&#39;s character.<br><br>What are the qualities of a leader?<br><br>Right!<br><br>It&#39;s a person who thinks only of himself.<br><br>I&#39;m sure he&#39;s rich.It&#39;s natural.<br><br>He works only for his own benefit.<br><br>The person who chose it is splendid.<br><br>They have great eyes!!"
1263,If you see    &quot;And We Know&quot;  channel   he shows proof of cheating during the debate<br><br>Biden wore a wire   AND   more   !!!
1264,I have so much respect for kindergarten teachers now!
1265,Thought they were deciding who gets the last piece of pizza for a second..
1266,😂
1267,Beautiful
1268,burn!
1269,"Hey family we need to heal the planet🌎 she need our help check out this video 🎥here’s the motivation Namaste🙏!<br><br><a href=""https://youtu.be/h2rerX5Edro"">https://youtu.be/h2rerX5Edro</a>"
1270,"Inspired by this news we designed fireproof house.  <a href=""https://youtu.be/U9bDxFSXijE"">https://youtu.be/U9bDxFSXijE</a>"
1271,Unbelievable Damage...
1272,California just needs to make forest fires illegal
1273,Directed energy weapons
1274,Only YOU can prevent Wildfires
1275,"Everyone living in those areas should get long hoses just like that gentleman and have them ready before the fire season starts, that’s what I would do. I would try to fight it, I wouldn’t go out without a good fight. I would feel bad with myself if I didn’t at least try the best I can to protect my home and keep it safe."
1276,Christ Is Coming Soon! These Are Signs💯Repent Now
1277,California has a long history of horrible forest management and they refuse to take advice from forest service. The Governor continues to blame it on fantasy theories.
1278,"Welcome to Commifornia! The Devils playground, hence all the fires."
1279,"The Tidings<br>In the name of Allah, the Beneficent, the Merciful.[78:1]<br>Whereof do they question one another ?<br><br>[78:2]<br>(It is) of the awful tidings,<br><br>[78:3]<br>Concerning which they are in disagreement.<br><br>[78:4]<br>Nay, but they will come to know!<br><br>[78:5]<br>Nay, again, but they will come to know!<br><br>[78:6]<br>Have We not made the earth an expanse,<br><br>[78:7]<br>And the high hills bulwarks ?<br><br>[78:8]<br>And We have created you in pairs,<br><br>[78:9]<br>And have appointed your sleep for repose,<br><br>[78:10]<br>And have appointed the night as a cloak,<br><br>[78:11]<br>And have appointed the day for livelihood.<br><br>[78:12]<br>And We have built above you seven strong (heavens),<br><br>[78:13]<br>And have appointed a dazzling lamp,<br><br>[78:14]<br>And have sent down from the rainy clouds abundant water,<br><br>[78:15]<br>Thereby to produce grain and plant,<br><br>[78:16]<br>And gardens of thick foliage.<br><br>[78:17]<br>Lo! the Day of Decision is a fixed time,<br><br>[78:18]<br>A day when the trumpet is blown and ye come in multitudes,<br><br>[78:19]<br>And the heaven is opened and becometh as gates,<br><br>[78:20]<br>And the hills are set in motion and become as a mirage.<br><br>[78:21]<br>Lo! hell lurketh in ambush,<br><br>[78:22]<br>A home for the rebellious.<br><br>[78:23]<br>They will abide therein for ages.<br><br>[78:24]<br>Therein taste they neither coolness nor (any) drink<br><br>[78:25]<br>Save boiling water and a paralysing cold:<br><br>[78:26]<br>Reward proportioned (to their evil deeds).<br><br>[78:27]<br>For lo! they looked not for a reckoning;<br><br>[78:28]<br>They called Our revelations false with strong denial.<br><br>[78:29]<br>Everything have We recorded in a Book.<br><br>[78:30]<br>So taste (of that which ye have earned). No increase do We give you save of torment.<br><br>[78:31]<br>Lo! for the duteous is achievement -<br><br>[78:32]<br>Gardens enclosed and vineyards,<br><br>[78:33]<br>And maidens for companions,<br><br>[78:34]<br>And a full cup.<br><br>[78:35]<br>There hear they never vain discourse, nor lying -<br><br>[78:36]<br>Requital from thy Lord - a gift in payment -<br><br>[78:37]<br>Lord of the heavens and the earth, and (all) that is between them, the Beneficent; with Whom none can converse.<br><br>[78:38]<br>On the day when the angels and the Spirit stand arrayed, they speak not, saving him whom the Beneficent alloweth and who speaketh right.<br><br>[78:39]<br>That is the True Day. So whoso will should seek recourse unto his Lord.<br><br>[78:40]<br>Lo! We warn you of a doom at hand, a day whereon a man will look on that which his own hands have sent before, and the disbeliever will cry: &quot;Would that I were dust!&quot;"
1280,"Wait, the one guy wants to use a hose to save his house?  He can’t do that, that water needs to be used to save the 3” long delta smelt fish that California covets so dearly, how dare he."
1281,"<b>JESUS IS COMING! Repent!</b> <br><a href=""https://youtu.be/IrA2hPL23fs"">https://youtu.be/IrA2hPL23fs</a>"
1282,"Stop  Investment on  useless  space research ....... because we can&#39;t go and live on moons, Mars, Galaxy s.  I think it&#39;s foolish thing to invest millions to go and live, it is impossible  and not required . and....it takes too many years to reach the Mars...... So where is the question of living there ?.........we living on Earth....so please love and save , don&#39;t harm ... the nature with us..... surrounded nature , forest , wildlife.  And love the animals...... instead of this.....we are destroyed, destroying   wild life habitates,forest .....till today. ......<br><br>Foolish space scientists..... not able to find the better methods to  calm down<br> or stop bushfire, flood s..... which affect the wild life, animals , forest  .....this is the  great arena we<br> live in"
1283,Feel bad for people who lost their home !!
1284,Interesting to use hectres. Us don&#39;t really use it
1285,Italian mafia!!!!
1286,How does he find time to get a tan??
1287,"I was diagnosed of herpes 4 years ago but no doctor could cure me until i came across Dr OSABA who gave me his medicine that revived my life and today i&#39;m tested negative to herpes I don&#39;t need to talk too much about Dr osaba but you too can contact him for any kind of cure on his email him <br>droosabacurehome@<a href=""http://gmil.com/"">gmil.com</a>      WhatsApp him via +2348132322488"
1288,"How does it feel to know that they did actually, mislead their readers? He actually paid millions of taxes  both years. And it was in the same article that you are actually talking about. You are a putz for spreading misleading information. The New York Times  actually finished the article...you should read it. Blundering idiots."
1289,BBC fake news is really just CNN lite
1290,turned out it was really fake news
1291,“The election of Donald Trump did not create the left’s hate.... it revealed it.”
1292,"Democracy in USA is under attack.THE democrats are hell bent on using &#39;&#39;mail in voting&#39;&#39; already proven open to all manner of election FRAUD. their impechment hoax has failed and now they cluth at the chaff ..THE STRAW HAS SUNK  the democrats are GOING DOWN FINNISHED ,DESPERATION . NEW YORK TIMES IS FAKE NEWS .NO ONE BELIEVES &#39;&#39;FAKE NEWS&#39;&#39;   BBC?  FAKE NEWS OR BOLSHEVICK BROADCASTING COMMISSARRIAT  TAKE YOUR PICK"
1293,"I read the NY Times entire report on it. 90% of it just states that Trump isn’t doing anything illegal; using tax credits and tax laws. You don’t pay taxes when you incur a net loss. What government says “give me money” when you didn’t make money, but in fact lost money??<br>The other 10%, if actually true, shows Trump evading taxes by paying companies that are owned by his children for consulting services and then writing them up as losses.<br>But even if this is true, you have to prove that they aren’t actual legitimate business transactions. Just because you are family doesn’t mean your individual companies can’t do business."
1294,fake news!!!
1295,He caught covid to dodge taxes. THAT IS dedication.
1296,Oh-I was supposed to pay them-ohhhh-go tax paying Joe
1297,The Amount Trump was said to have payed in legal terms this would be called hearsay evidence and non admissible in a court of law. As to tax record release if it was a legal Issue the courts could subpoena the records as far as i have seen they have not. The story is fake news.
1298,TYPE jerry NADLER craps his PANTS during PRESS conference lmao
1299,Defund the BBC!
1300,He literally uses that excuse everytime. Whenever something bad is said about him he says it&#39;s fake news. I&#39;m not American but I have to say myself that it&#39;s really suspicious and concerning.
1301,"What about Biden and Son HUNTER !!! WHERE DID HUNTER GET OVER A BILLION DOLLARS?! FROM CHINA, UKRAINE, MOSCOW AND WHAT DID BIDEN GIVE THEM OR DO FOR THEM TO GET THESE COUNTRIES GIVE HIM ALL THIS MONEY, HE HAD NO EXPERIENCE IN ANYTHING !!! AND DON&#39;T FORGET BIDENS 6 BILLION DOLLAR QUID PRO QUO?!! HE BRAGGED ABOUT IT ON TY ! FIRE THE PROSECUTOR INVESTIGATING THE COMPANY JOE&#39;S  SON GOT. MILLIONS FROM FOR DOING NOTHING AND NO EXPERIENCE !! BIDENS A LIAR, A RACIST AND A CHEATER !! ITS ALL PUBLIC NOW SO LOOK IT UP !!!"
1302,The media have been bought buy Chinese government. Everything you hear now against Trump is fake news. People will soon realize how deep they are into communist lies.
1303,G good morning jee namaste jee unique BBC
1304,Oh thank god it&#39;s ok now hes denied it
1305,"If this was &quot; fake &quot; news, then wouldn&#39;t Trump be able to sue them for libel and/or slander? This is simply one small hole in a pin cushion of lies and malfeasance Trump has committed.He is a grotesque anomaly in politics."
1306,"BBC pretending to care about the people they terrorise for the license fee <a href=""http://www.youtube.com/results?search_query=%23defund"">#Defund</a>"
1307,"I am so happy Dr Abiola has make me to be happy Dr Abiola was able to cure me totally from HIV disease with his natural roots and herbs he sent to me after two weeks of usages I went for a check up and when the result was out it was negative you can get in touch with Dr Abiola if you are suffering from HIV disease so that he can also cure you totally as he did mine via email drabiolahome@<a href=""http://gmail.com/"">gmail.com</a> or message him on whatsapp +2348163587231  I am so happy Dr Abiola has make me to be happy Dr Abiola was able to cure me totally from HIV disease with his natural roots and herbs he sent to me after two weeks of usages I went for a check up and when the result was out it was negative you can get in touch with Dr Abiola if you are suffering from HIV disease so that he can also cure you totally as he did mine via email drabiolahome@<a href=""http://gmail.com/"">gmail.com</a> or message him on whatsapp +2348163587231 kk"
1308,"What is the impact of these crippling lockdowns on people I wonder?  Is it worse than the virus itself, just a thought..."
1309,"Repeal the coronavirus act.. Sign and share<br><br><a href=""https://petition.parliament.uk/petitions/313310"">https://petition.parliament.uk/petitions/313310</a>"
1310,"Dave, King Simp."
1311,"My father died on his own, no family around him, in a care home in March. He had dementia and had had a kidney infection and heart attack the week before his death. He was turfed put of hospital twice and when he was found unresponsive in his care home room, was not allowed back to hospital. Its been hugely outrageous this. He was also left without food and water for 20 hours on a side ward the last time he was in hospital and they had the nerve to send him back to care home at 1.30am. Shame on everyone involved in this scamdemic."
1312,"I&#39;m so proud to live in a country where a German doctor can be arrested for having a different opinion than our Prime Minister. It is great to live in a country where people who could not possibly pass on a virus they don&#39;t have, are forced to wear a mask of subservience. I envy the students of this country, 4 people under twenty years old have died of covid since this started, yet we can still virtually lock them up on such a flimsy pretext. There is so much more to celebrate, it is getting to be even better than Germany in the late 1930s.And it&#39;s great that the words &quot; Britons never shall be slaves&quot; are something the national broadcaster doesn&#39;t approve of."
1313,"CANCEL YOUR TV Licence save £150 every year.    A licence is only needed to watch or record LIVE TV and use BBC iPlayer.<br><br><br>It is NOT needed to use catch up services, DVDs and Netflix"
1314,"Prof Dolores Cahill explaining just what a load of shite the government is telling us. <a href=""https://brandnewtube.com/watch/dolores-cahill-22nd-september-2020_qduXX2PZDJ4EewE.html"">https://brandnewtube.com/watch/dolores-cahill-22nd-september-2020_qduXX2PZDJ4EewE.html</a>"
1315,"All the rules and regulations that have been put in place are to deliberately kill off the sick and vulnerable under the guise of caring for them...that&#39;s the sickening inversion of what&#39;s taking place here.  None of this was ever about a virus, it&#39;s about laying the foundations of their AGENDA 21/30 agenda, time to wake up people!"
1316,"Hoping someone can answer this question? In July Chris witty the chief medical officer stated in a parliamentary select committee hearing that the virus was already in retreat prior to the implementation of lockdown. The reason for this is that the case data in March and April Was incomplete due to a lack of testing therefore the most accurate data during the 1st wave of the pandemic was the data for deaths. The peak in deaths according to the ONS Was on a 8th April, studies show That on average it takes 3 weeks to die from  coronavirus after contracting it.  Therefore in order to find the true peak in the number of cases you would count back roughly 3 weeks from the peak in deaths That would take you to several days prior to the implementation of the lockdown. Also Add to this as outlined recently by sage lockdowns take at least 2 weeks to start reducing transmission.  So it is impossible to claim that the lockdown caused the peak in the number of infections,  as it would have had to have been implemented as early as the 7th of March (prior to the cheltnam festival and liverpool vs athletico).<br><br>The sage group  Has stated that lockdowns do not prevent Infections they merely push infections into the future and therefore lockdown measures do not  Prevent deaths they delay when they happen. the purpose of the lockdown measures is to slow transmission So hospitalizations dont Rise too quickly and overwhelm the NHS. <br><br> So if the peak in infections was prior to the implementation of lock down then the peak number of hospitalizations and deaths was not reduced by lock down either and As the nhs was never overwhelmed It would suffice to sayThat the lockdown was pointless as The nhs was never going to be overwhelmed.<br><br>Agree or disagree"
1317,Covid 19 does not exist.
1318,"Nice bit of guitar and vocals, Dave!"
1319,"Medical doctor from the extraordinary comitee of Corona ACU/Germany <br>was arrested for 22 hours by police in London. He was speaking <br>at a protest against Corona measures and for freedom and human rights. <br><a href=""https://youtu.be/AefvRNm0K1I"">https://youtu.be/AefvRNm0K1I</a>"
1320,"Although I agree that this is an important issue, the most important story right now is the Julian Assange show trial happening right now and you are silent about it. Why?<br><br>Is our relationship with the USA more important than the truth or exposing war crimes by mi6?"
1321,"If You Tolerate This Then Your Children WIll Be Next. WAKE UP - <a href=""https://www.bitchute.com/video/Z5WXPjgruX9T/"">https://www.bitchute.com/video/Z5WXPjgruX9T/</a>"
1322,MORE CONTROLLAVIRUS PROPAGANDA
1323,"👁️NWO NEWS 🕵️‍♂️<br>LONDON PROTEST AGENTS <br><a href=""https://youtu.be/EiVEyy37CX0"">https://youtu.be/EiVEyy37CX0</a><br>⭐Rᴇsɪsᴛ ᴛʜᴇ ɴᴇᴡ ᴡᴏʀʟᴅ ᴏʀᴅᴇʀ⭐"
1324,impact of bbc
